submission_date,reviewer_id,product_id,product_name,product_brand,site_category_lv1,site_category_lv2,review_title,overall_rating,recommend_to_a_friend,review_text,reviewer_birth_year,reviewer_gender,reviewer_state
2018-01-01 09:54:50,872e88e9fcde60c319a0e1e9e06c108bb408f73f2bed6776023bc21d2301a160,111624490,Aparador de Pelos Philips BG2024/15 Seco & Molhado Bivolt,philips,Beleza e Perfumaria,Barbearia,Ótimo,4,Yes,"O produto cumpre com o anunciado. Funciona muito bem embaixo do chuveiro, não machuca a pele",1985.0,M,PR
2018-01-01 09:56:20,b9cd66019c5a4176151a1372244f617512624a413405c5e2041a7875df12e4b2,22198649,Filtro Com Torneira Acqua Bella Black - 7411819 - LORENZETTI,,Casa e Construção,Materiais Hidráulicos,Filtro maravilhoso.,5,Yes,"Excelente produto, fácil instalação. Deixa a água com gosto maravilhoso.",1979.0,F,RJ
2018-01-01 09:57:31,c787c239560caf9f4bfe5b39b0a1b41ce66ef10b4c8583a2165959b30b4851c1,113959146,Bicicleta Spinning Kikos F5,kikos,Esporte e Lazer,Musculação e Fitness,Bom.. mas poderia ser melhor.,3,Yes,"É um bom produto, mas com pequenos ajustes e mudanças poderia ser excelente. Por exemplo: um banco mais confortável e pedais mais resistentes.",1984.0,M,SP
2018-01-01 09:59:39,eeda5c6aa4915ec24c99e363638fb86ac0fd995ba960456ca6dc2eb9cf5d51a3,23223407,Conversor Gravador Digital Full HD Aquario - DTV-4000,,TV e Home Theater,Acessórios para TV e Vídeo,produto bom,5,Yes,"O tamanho dele é pequeno, mas é muito bom.Seu desempenho  é perfeito. Aconselho a comprar.",1956.0,F,SP
2018-01-01 09:59:55,1b152538a2d178312f203d05f6265befdcbd8572c560725b166c37f5fc8900ee,132439701,"Smart TV LED 39"" Philco PH39N86DSGW HD com Conversor Digital 3 HDMI 1 USB Wi-Fi Closed Caption e Sleep timer",,TV e Home Theater,TV,Ótimo,5,Yes,Ótimo custo-benefício recomendo comprar.                                                                    Ok,1982.0,M,MG
2018-01-01 09:59:57,1e926b3472c7e45c4102eafdce65be07f7dac5d0105c7dff9f4d6fefbdd5516e,27798113,"Quarto Infantil com Guarda Roupa 3 Portas, Cômoda e Berço Mini Cama Benjamin Rústico/Branco",,Móveis,Quarto Completo,,5,Yes,"Gostei muito dos produtos, guarda roupa grande espaçoso, comoda grande com gavetas enormes que desliza que é uma maravilha, berço cama que ótimo com rodas que pode movimentar de um lado para outro, muito bonito causou todos que estão vindo visitar meu neto gostaram muito do jogo de quarto dele.",1968.0,F,RJ
2018-01-01 10:00:22,97239534ef7628544f9db4939c4081e940783e32fb8bb88183d91301e5319421,126150231,Filtro de Linha ELG PowerCube Extended 5 Tomadas Bivolt,elg,Celulares e Smartphones,Acessórios para Celular,Praticidade,4,Yes,"- Produto prático e ocupa pouco espaço, além de poder ser usado com outros produtos da mesma marca ampliando a sua capacidade.",1964.0,M,AM
2018-01-01 10:01:01,97239534ef7628544f9db4939c4081e940783e32fb8bb88183d91301e5319421,126150215,Filtro de Linha ELG PowerCube Original USB 4 Tomadas Bivolt,elg,Celulares e Smartphones,Acessórios para Celular,Praticidade,4,Yes,"- Produto prático e ocupa pouco espaço, além de poder ser usado com outros produtos da mesma marca ampliando a sua capacidade.",1964.0,M,AM
2018-01-01 10:04:36,a83e419c5e7dee86df96168d305573904ecd99637901845310f1a9d7ed6ab44d,25747103,Carregador MagSafe de 60W para MacBook Pro 13 pol e MacBook Air 13.3 pol - Mymax,,Informática e Acessórios,Acessórios para Notebook,Tudo correu bem,3,Yes,Tudo correu bem e chegou antes do prazo!!! Produto funcionou bem,,M,SC
2018-01-01 10:05:54,fa5c58874092c0cbf37fdebdcd07cc6119502803c3eb4e40361b2046e8425fa8,131657539,"Smartphone Samsung Galaxy J2 Prime TV Dual Chip Android 6.0 Tela 5"" Quad-Core 1.4 GHz 16GB 4G Câmera 8MP - Preto",samsung,Celulares e Smartphones,Smartphone,"Corresponde as expectativas, bom custo benefício",4,Yes,"Produto muito bom, smartphone que cumpre as necessidades. Sem muitas funções, mas com o essencial. Recomendo para quem quer economizar e investir em um produto de qualidade.",1998.0,F,SP
2018-01-01 10:06:29,fa5c58874092c0cbf37fdebdcd07cc6119502803c3eb4e40361b2046e8425fa8,131657512,"Smartphone Samsung Galaxy J2 Prime TV Dual Chip Android 6.0 Tela 5"" Quad-Core 1.4 GHz 16GB 4G Cãmera 8MP Rosa",samsung,Celulares e Smartphones,Smartphone,"Corresponde as expectativas, bom custo benefício",4,Yes,"Produto muito bom, smartphone que cumpre as necessidades. Sem muitas funções, mas com o essencial. Recomendo para quem quer economizar e investir em um produto de qualidade.",1998.0,F,SP
2018-01-01 10:07:24,918eb015b1abaf29f348871f0e00b6f4c7a330dc9d5907841a8d488593430eee,132517301,"Smart TV LED 28"" Philco Ph28n91dsgw HD com Conversor Digital 2 HDMI 1 USB Wi-Fi",,TV e Home Theater,TV,"Gostei da Tv, mas o controle remoto está sem funciomamento.",2,Yes,"O controle remoto da TV Philco Smart TV LED 28"" Philco  está sem funcionamento. Precisei acionar uma Reclamação em desfavor da Philco para o envio de um novo controle remoto.",,,
2018-01-01 10:08:31,c22cef7c2917454e11f7224f96dd6c3560dfb87723db6d512ba58ab12c82abab,346121,DVD Sex And The City 4ª Temporada (3 Discos),,Filmes e Séries,Séries de TV,Gostei muito!,5,Yes,Dentro do prazo e com sistema de rastreamento online!,1982.0,F,SP
2018-01-01 10:14:10,b8856847ab07b68d0ce7d35132a3e533bf65971a26cd99157bc85d1abcc1dde6,132380720,"Smart TV LED 55"" Samsung 55MU6100 UHD 4K HDR Premium com Conversor Digital 3 HDMI 2 USB 120Hz",,TV e Home Theater,TV,GosteGostei do meu produto,3,Yes,"Gostaria de saber como obter uma melhor imagens  , esperava uma qualidade maior de imagens",1974.0,M,DF
2018-01-01 10:16:23,5352d555fd625cd718884dcaa2eda7fedb9ffa62b07031d55dfa17b54ece294b,14573395,Luminária Painel Plafon Led Quadrado Embutir-18w-6500k,,Decoração,Luminária,Produto muito bom,4,Yes,O produto atendeu as expectativas.  Até o momento não tive nenhum problema.,1987.0,M,SP
2018-01-01 10:17:41,77bcb61a181be4f87bb05bb383990d955cc4e56bb34756f35556e88138c45aca,132764723,Prancha Philco Titanium Fashion N Bivolt,,Beleza e Perfumaria,Aparelhos elétricos para cabelo,Bom produto,4,Yes,Ótimo custo benefício Americanas arrasando na entrega,1985.0,F,SP
2018-01-01 10:17:54,d52de82aa4570798ace330cef124f6724c9bfc0c75c68682a1071812f9f56adf,23410638,Kit 4 Tintas para HP Deskjet GT 5822 | GT51 | GT52 CMYK 500ml Inova Ink,,Informática e Acessórios,Tinta para Impressora,Raiva,1,No,"Estou muito decepcionado com esta empresa, pois fiz o pedido dos produtos em 01/12 e ate o momento ainda não chegou. O que aconteceu com o pedido?????? aguardo uma resposta salutar!",1979.0,M,AP
2018-01-01 10:17:54,71d42a1e5bc9b40f40f2cc9287d470db44d11995a355cdea33f079af6c2c2b2c,121825341,Bebedouro de Água Cadence Pure Vità Elegant BEB101 Branco,cadence,Eletroportáteis,Bebedouro e Purificador de Água,regular,2,No,o modelo muito bonito.porem  veio com defeito. vazando agua,1962.0,F,MG
2018-01-01 10:19:17,4242c11c00a1a7ed90c79d8689aa20c178ea9cc963175cd7f789c4da0f173b60,129304494,"Liquidificador Philco PH Touch 2,7L 3 Velocidades Branco - 800W",philco,Eletroportáteis,Liquidificador e Acessórios,"muito fraca pra minhas nessecidades,o encaixe do copo não tem trava!!",2,No,"deveria ter uma trava pra o copo, que apenas é so colocar. muito fraco!",1973.0,M,SP
2018-01-01 10:21:21,f27b2b7a7d32467c071f3bd71efc6719f324a576010055e6968e4b92e53ea761,131234763,"Chaleira Elétrica Cadence Thermal CEL370 1,7L Preta - 1850W",,Eletroportáteis,Chaleira Elétrica,"Gostei, já conhecia o tipo do produto",3,Yes,"Já  conhecia este tipo de chaleira, comprei a Cadence pois queria preta e apareceu no Facebook a promoção, não  conhecia a marca, já  utilizei e fiquei satisfeita. Espero que a durabilidade seja longa.",1977.0,F,GO
2018-01-01 10:22:30,3e96bc2b1ffcb0dc4c475185a9679ae19d055d110c2e82022d042795de6333dc,131471591,"Smart TV LED 40"" Toshiba 40L2600 Full HD com Conversor Digital 3 HDMI 2 USB Wi-Fi 60Hz - Preta",semp toshiba,TV e Home Theater,TV,O melhor custo benefício do mercado,4,Yes,"Primeiramente gostei da entrega muito rápida. Segundo a Tv pelo preço é excelente, a qualidade de imagem é muito boa o som e bastante potente. O netflix excelente roda uma maravilha. You Tube também não tive problema, pois roda muito bem, as demais funções smart Tv ainda não testei,  outra vantagem é que pelo preço acredito que não exista nenhuma tV com 3 entrada HDMI e duas USB, o que dar para conectar até 5 equipamentos ao mesmo tempo, como a SKY, game e HD externo no meu caso. No mais estou com a TV há 5 dias e estou muito satisfeito. E olhando por alguns cometário aqui fiquei até com medo, mas com o produto em mão, fiquei surpreendido positivamente.",1980.0,M,PE
2018-01-01 10:22:54,3c9e5d81d3b182c870c86980cf727838d71543c24ac7eb64f114d41c51b9cc80,116395251,Cafeteira Elétrica Cadence Single CAF114 com 2 Xícaras - Amarelo,cadence,Eletroportáteis,Cafeteira,Muito boa,5,Yes,"Ótima, superou as expectativas! O café sai quentinho e ela e super fácil e rápida! Adoramos!!!",1971.0,F,SP
2018-01-01 10:23:10,9f3fade9a4870c4587e617eb563741fbb0ef413940f0408fec58b58790b6c4b2,11309904,Conjunto Organizador De Pia 4PCS Vermelho 99209/4053 - Coza,,Utilidades Domésticas,Utensílios e Acessórios Domésticos,Ótimo,4,Yes,"Mto bonitos, de acordo com o esperado.  Bom acabamento.  Material bom",1991.0,M,SP
2018-01-01 10:23:22,2badd4eb496c73465118a7c6db6ca36308534fd48df69ef92f344821befbfb6b,125453193,Barbie Princesa Penteados Mágicos - Mattel,mattel,Brinquedos,Barbie,minha filha adorou o produto,4,Yes,minha filha adorou o produto.oooooooooooooooooooooooooooo,1975.0,F,SC
2018-01-01 10:24:23,50d6e07038f38c1bb99b6d6f042e3bd744eaf4831cff533ab13b6fd975eb93f3,112941067,Aparador de Pelos Philips Multigroom Series 3000 QG3340/16 com Acessórios,philips,Beleza e Perfumaria,Barbearia,Muito Bom,5,Yes,"Entrega dentro do prazo, produto de qualidade, gostei bastante dos acessórios, a barbar bem próxima da feita com gilete e isso é muito bom pois tenho alergia as lâminas e com esse barbeador não fico encaroçado no rosto, usei a bateria que veio do aparelho umas 3x, durou bastante na minha opinião, recomendo.",1996.0,M,SP
2018-01-01 10:25:21,b48d5bc769a09e555719dec54a7f7f1d7b4c2daff084452a672ef25daf842b2d,25792962,Máquina De Corte 110v Magic Prata/vermelha Wahl + Gel Roger,,Beleza e Perfumaria,Barbearia,Excelente produto,4,Yes,Recomendo o produto  alta qualidade Show de bola!!! Clean do clean,1982.0,M,RJ
2018-01-01 10:25:43,3bdd78cfd08794192299cafa58d9301a670844392c47282524ed91be4d024c29,23821957,Porta-cápsulas Giratório Cromado Para 32 Cápsulas,,Utilidades Domésticas,Utensílios e Acessórios Domésticos,Porta cápsulas,5,Yes,Produto de ótima qualidade. Entrega super rapida.... super recomendo.,1977.0,F,PR
2018-01-01 10:26:42,60b222ebba4a68846515eb437a0107653ec80f13a36a018e343a485d6608d1e6,122958719,Tratamento Aussie Moist 3 Minutes Miracle 236ml,aussie,Beleza e Perfumaria,Produtos para cabelo,Muito bom,5,Yes,"Um dos melhores produtos que já usei, simplesmente perfeito entrega rápida como sempre! Melhor site de compras",1985.0,F,SP
2018-01-01 10:27:15,6855631630267ad4f4ff898ddd13ef870b8c654bae8f4cc4ed3da49204a5b9f0,22562178,Copo Acrílico Com Canudo 500ml Rocie,,Utilidades Domésticas,"Copos, Taças e Canecas",preço do milheiro de copos,1,No,"como é que conseguem deixar um copo anunciado por 1.994,20? estão vendendo por milheiro agora?",1970.0,M,RS
2018-01-01 10:30:03,ba52ba816df2d1412f4552a05fc829fddc7119ad7ba21dfa8ec782487cbf9de7,113150136,Game Grand Theft Auto V - Xbox 360,t2,Games,Xbox 360,Não gostei.era presente de natal e até hoje ele não conseguiu instalar...sempre da defeito,1,No,Muito ruim.nao gostei.meu sobrinho ficou super ansioso o jogo chegou e não instala de forma nenhuma já trocamos o pen drive já tentamos de tudo.frustrante,1976.0,F,MG
2018-01-01 10:34:00,8504205d3965079429757ef410bc881a2f593a0fec0c451d5dfe134b12d07ee8,28921917,Motorola Moto C 8GB 3G Película de Vidro e Capa de Silicone Dual Sim Tela 5 - Preto,,Celulares e Smartphones,Smartphone,Aparelho importado,1,No,"Aparelho importado, garantia somente a através deste processo. Vende gato por lebre!!!",1986.0,M,MG
2018-01-01 10:34:44,0cddd9baa866debf0911d0c2288e38926abf37c1f32e03f80eaec580165b5aa0,15987997,Smartphone Alcatel Pixi4 Colors - Preto,,Celulares e Smartphones,Smartphone,adorei,5,Yes,"vem conforme o prometido, comprei para 2 sobrinhos, eles adoraram e por ser o mesmo produto , as 4 capas coloridas os ajudam a não se confundirem.  e o prazo de entrega também é cumprido.",1989.0,F,SP
2018-01-01 10:39:11,154bdb7790d9d29071aab3c99c330b7b2f8423889e500b5e12fe1cb18ac09210,25793422,Kit Prancha Chapinha Nano Titanium 450 °F e Modelador De Cachos Nano Titanium,,Beleza e Perfumaria,Cabelo,"super indico,estou apaixonada",5,Yes,"superou minhas expectativas,meu cabelo e de 70 cm fiquei com medo de não cachear,por   causa do tamanho,mas pegou todo o cabelo e fez cachos perfeitos,minha irma enlouqueceu, logo  fez  no dela e amou também, e já comprou o seu,esta ansiosa aguardando chegar,os cachos durão muito ameiiiiiiiiii.",1988.0,F,MG
2018-01-01 10:41:37,f1f0b993ae6505e610f92739ba4485083dc5339f2de4c8e12859924a3e93cdb8,22562178,Copo Acrílico Com Canudo 500ml Rocie,,Utilidades Domésticas,"Copos, Taças e Canecas",Melhor produto da minha vida,1,No,"Excelente custo beneficio, Com esse preço dei pra minha família toda...recomendo",,,
2018-01-01 10:42:16,940f8db804733f76e24f832a314771d7f8a0fed055b84b53ab02f008131e2b24,7294679,Umidificador e Ionizador Ultra-sônico - 3 Litros Bivolt - G-Life,g-life,Saúde,,Custo benefício,5,Yes,Melhor custo benefício. Cumpre o q promete. Cuidado com o armazenador da água.,1983.0,F,SP
2018-01-01 10:42:38,26cd101c547269ebe22f82d9a3e513968d3fbbaed50ee522ac87cba60939d6b9,22562178,Copo Acrílico Com Canudo 500ml Rocie,,Utilidades Domésticas,"Copos, Taças e Canecas",Excelente custo benefício,5,No,"Adorei o produto, o preço está totalmente acessível ao meu bolso, comprei para toda minha família dois, para no caso de quebrar um, (devido ao acrílico rsrsrs) eles terem outro. Adorei o copo. Recomendo a todos esse copo, mesmo que não tenha dinheiro, junte para compra-lo vale totalmente o investimento.",,,
2018-01-01 10:43:10,8eda427153e775af5f5a0e48c1ea66bbcc4e4fe9a239f454e444f498b85c6af7,12671477,"Celular Para Idosos Dl Yc110, Dual Sim, Tela 1.8”, Radio Fm , Com Exclusiva Função Sos",,Celulares e Smartphones,Celular,Ótima,5,Yes,"Gostei muito do celular pq é para pessoa que tem problema de visão,os números tem um tamanho bom!                          Muito bem recomendado aos idosos                              Obrigada",1967.0,F,SP
2018-01-01 10:45:05,991901aebfe8da1c95f22894b60150687ced6613bc38ba34ad37ae99e304832d,126474851,Aspirador de Pó Philco Rapid 1000N Vermelho/Preto - 1000W,philco,Eletroportáteis,Aspirador e Vassoura Elétrica,Ótimo produto,5,Yes,Produto de ótima qualidade e chegou dentro do prazo.,1981.0,M,RS
2018-01-01 10:45:44,9ea6ab21b693fe164c1bd3f6c944183e2631dd7c29639df1c22a11000e39cf4e,22562178,Copo Acrílico Com Canudo 500ml Rocie,,Utilidades Domésticas,"Copos, Taças e Canecas",Inacreditável,1,No,"1994,00 reais em um copo? Vcs estão de sacanagem né.... Isso é o valor da máquina de fazer esses copos né....",1988.0,F,RJ
2018-01-01 10:49:32,99838b6d0b8ef0b5a96bff1d64e55d95781f03cbaba3afcbb60a8378bcffc4da,129712332,"Smartphone Lenovo Vibe K6 Dual Chip Android Tela 5"" 32GB 4G Câmera 13MP - Grafite",motorola,Celulares e Smartphones,Smartphone,Celular que não faz ligação!,1,No,"Este celular não tem contatos quando você clicar para discar ele começa a atualizar o programa e não funciona, além disso esquenta rápido e começa a bulgar! Estou pedido o cancelamento da compra! Fica a dica!",1980.0,M,RJ
2018-01-01 10:49:33,af78ed56df54e056f5acd37d0e9dc3f4ba9fc681d91ddfda989749996a28c5e9,121041757,Livro - Capitão Cueca (Edição de Colecionador) - Vol. 1,,Livros,Biografia e Memórias,Gostei demais,4,Yes,Entrega super rápida e uma ótima leitura. Adoro comprar nesta loja que sempre entrega antes da data prevista,1953.0,F,SP
2018-01-01 10:49:34,de882ed899c92156e26d45528a73aa78b83acf19c550156d5bfdff6658d12310,132444092,"Smartphone Motorola Moto G 5S Dual Chip Android 7.1.1 Nougat Tela 5.2"" Snapdragon 430 32GB 4G Câmera 16MP - Platinum",,Celulares e Smartphones,Smartphone,Excelente!!!,5,Yes,"Excelente produto, belo design, fácil de manusear. Super satisfeita.",1966.0,F,PR
2018-01-01 10:50:48,42ef2ff691a4dd47f7d974358d6a3e092d8bba558b215f33aef10be909f25d15,125628846,"Smart TV LED 43"" Samsung 43j5200 Full HD Conversor Digital 2 HDMI 1 USB - Preto",samsung,TV e Home Theater,TV,Gostei muito,4,Yes,"muito bom recomendo, satisfeito com a Tv , chegou no prazo previsto",1972.0,M,SP
2018-01-01 10:50:49,2c0ee5d1e14b37aea60d958a2d1e1c1c0d7e21d12ba960d4a58cd8ef9fdc655e,13166223,Gps Tracker Touchscreen 7.0 Pol Com Tv Digital Multilaser-Gp038,,Automotivo,GPS,Otima tv divital,4,Yes,"Amei a tv digital, uso a noite no meu trabalho atendeu as minhas necessidade , so tenho uma reclamaçao a bateria dura apenas 2:30 h, sendo a partir dai necessario conecta-la a uma fonte de energia..",1971.0,F,PA
2018-01-01 10:51:14,62a929b89e1acbd0d2e0fbd5df9f2fbe955bfcefe343deeab2bc20695542f726,15174904,Vinagre De Maçã Orgânico 500 Ml 100 Natural,,Alimentos e Bebidas,Azeite e Vinagre,Produto de excelente qualidade.,5,Yes,"Ele e muito bom ,bom, bom , bom , bom. BOM BOM BOM Tao bom ,que fica ruim.",1964.0,M,MG
2018-01-01 10:52:08,ba0b6f6d91368f7e6eaab31791fe7f7133bae16ff07a2de46799aa79fc707acb,125770480,Bicicleta Infantil Nathor Feminina Flower Aro 12,nathor,Brinquedos,Bicicleta Infantil,Não consigo avaliar oq não recebi.,1,No,"Um baita descaso, estava programado para chegar no dia 22, pois comprei justamente para presentear no Natal, a empresa demorou vários dias para postar até imagino que vão dizer que a culpa é dos correios, não compro mais da americanas, não recomendo nem pra inimigo! Estou muito insatisfeito!",1985.0,M,SC
2018-01-01 10:53:47,9077a4a0cc035fc862efe623410f310fbc1bf10ee7d7e1295a86b2b27df9704c,132569944,Notebook Samsung Essentials E35S Intel Core i3 4GB 1TB Tela LED HD 14'' Windows 10 Cinza - Samsung,,Informática,Notebook,Muito bom,4,Yes,Notebbok muito bom! Rápido pequeno e leve para quem quer um notebook com um bom desempenho e que oculpa pouco espaço ele é perfeito. A autonomia da bateria é muito boa. Ele liga e desliga muito rápido.,1991.0,M,MG
2018-01-01 10:55:34,90070cc64350f419ae89fca9ded6ad612f9f24c9b8399c663b9382cad7868b2c,12910151,Lança Protetora 1m Pct C/ 10 Pçs Cód.78/996 - Código 9777 Perimetral,,Instrumentos Musicais,,Não entregaram,1,No,Não entregaram o produto e até agora não recebi resposta da restituição do pagamento.  Péssimo para mim e possivelmente para Americanas.,1976.0,M,SC
2018-01-01 10:59:00,31a6e82d262911dc266142900af5f317b2078d2d419ce85edba9d33115231c49,125215742,Liquidificador Philco PH900 2L 12 Velocidades Vermelho - 900W,philco,Eletroportáteis,Liquidificador e Acessórios,Adorei o produto,5,Yes,Muito bom! Produto entregue antes do prazo gostei muito mesmo!,1990.0,F,PE
2018-01-01 10:59:01,bfea23d2a6e724eb3030cc883497ecf1dcba58fc03d44648525206098fca15b8,5710794,Perfume Euphoria Masculino Eau de Toilette 100 ml- Calvin Klein,calvin klein,Beleza e Perfumaria,Perfumaria,Produto aparentemente falso,1,No,Produto aparentemente falso de pesima qualidade nunca pensei que uma loja como americanas aceitaria ser comecliza um produto desse não tenho mais coragem de compra perfumes na Americanas,1974.0,F,BA
2018-01-01 11:04:43,2693e174f010dc1b3a6d92a5180712e4a5509b289de0961283c976622104cbf2,132649725,Game - Call Of Duty WWII - Xbox One,,Games,Xbox One,Call Of Duty WWII,1,No,"Campanha ridícula, cheguei ao fim em algumas horas de jogo sem esforço.",1972.0,M,RJ
2018-01-01 11:05:16,38127b104098a3cb2352037dee04849fac55685ecc40f5bc728992276c08641f,27695701,Cesto Inox Cozimento A Vapor Cozinhar Legumes 23cm Saudável,,Utilidades Domésticas,Utensílios e Acessórios Domésticos,Gostei muito do produto.,4,Yes,A entrega foi dentro do prazo. Produto atendeu bastante minhas expectativas.,1958.0,F,SP
2018-01-01 11:07:57,82b058ce02ff35bd8c3649f5a636e8daa7658067496d7185b2b2abfaf4f92a74,115518361,Jogo Elefun - Hasbro,hasbro,Brinquedos,Jogos,Decepção,1,No,"as borboletas não voam, somente quando colocamos o elefante na horizontal que as borboletas saem.",1980.0,F,SC
2018-01-01 11:08:40,9799aa107957182471bfeb72206799a67f44ee8bf086146edd72b716d6377528,131664641,"Smartphone Samsung Galaxy J7 Prime Dual Chip Android 6.0 Tela 5.5"" Octa- Core 1.6 GHz 32GB 4G Câmera 13MP - Rosa",samsung,Celulares e Smartphones,Smartphone,J7 prime,5,Yes,"Produto muito bom, véi conforme a descrição no anúncio, porém o a demora na postagem foi grande, demorou muito pra chegar.",1982.0,M,RO
2018-01-01 11:08:56,a7b140a36f4cb32372c75b3c2c717d3069bcc28e0ceb0335a0616c87147db642,132444092,"Smartphone Motorola Moto G 5S Dual Chip Android 7.1.1 Nougat Tela 5.2"" Snapdragon 430 32GB 4G Câmera 16MP - Platinum",,Celulares e Smartphones,Smartphone,Problema com o aparelho,1,No,"Boa tarde. Estou insatisfeita com o aparelho, o mesmo está apresentando problemas na câmera frontal, na verdade a câmera está travada e não há o que fazer.  Quero trocar o produto.",1995.0,F,SP
2018-01-01 11:10:10,9799aa107957182471bfeb72206799a67f44ee8bf086146edd72b716d6377528,129543938,"Smartphone Samsung Galaxy J7 Prime Dual Chip Android Tela 5.5"" 32GB 4G Câmera 13MP - Dourado",samsung,Celulares e Smartphones,Smartphone,J7 prime,5,Yes,"Produto muito bom, porém a entrega é muito demorada, levaram 2 meses pra entregar, isso é absurdo!!!",1982.0,M,RO
2018-01-01 11:11:33,788b8e6c5f99f59b7a8e7a5bc87d7a1082927e5f22b25225492d36bb740d8220,122106954,Caixa Amplificadora Mondial MC0-02 Mult Conect Power Bivolt 40W,mondial,Instrumentos Musicais,Som Profissional,Excelente!!!,5,Yes,Só o microfone que dá muito ruído...mas o aparelho já tenho igual ...da mesma marca faz mais de três anos sem nenhum defeito e a bateria ainda dura umas três horas...,1973.0,F,SP
2018-01-01 11:13:49,f39e8a09fcf9c991b845c3c2dcf4b14f7cf3d4e701bbba659380fd98a0acbd89,23277475,Prancha Escova Removedora De Pontas Duplas Fasiz Split Corte,,Beleza e Perfumaria,Barbearia,Otimo,4,Yes,Amei ... Excelente compra... Podem comprar ...aprovado... Veio td certinho e completo,1978.0,F,SP
2018-01-01 11:14:48,51dec9a1a166c9d86d73bf02036e46aa8107dc60937b2710c902834efb84cff2,15861945,Kit 4 Refil Tinta Para Epson Ecotank L200 L210 L220 L355 L365 L375 L555 L575 L800 L805 L1300 280ml,,Informática e Acessórios,Tinta para Impressora,Bom,4,Yes,"Gostei das tintas são muito boas, vou usa elas agora",1971.0,M,BA
2018-01-01 11:17:14,77d9d37e09962fcd4d623de2e4ca273ada02c6c9694eebff4e9762a31cdec9ba,14738991,Guarda-Roupa com Espelho 3 Portas Poe Siena Móveis Malbec,,Móveis,Guarda-Roupa,Insatisfeito,3,Yes,"O produto é bom, mas um dos espelhos veio quebrado",1984.0,M,PB
2018-01-01 11:25:21,56a6ddb207cea945dc329300bc0742d3d0a33d35853bc77087bec3d27de1f2cb,7764135,Fraldas Descartáveis Huggies Turma da Mônica Tripla Proteção Mega XG - 42 Unidades,huggies,Bebês,Higiene e Saúde,Confiança,5,Yes,"Confio muito nesta marca, porém compro quando está na promoção. Mas é ótima confio de olhos fechados.",1985.0,F,SP
2018-01-01 11:29:05,95cbf915c78bbc0acbbe435cfd6eec89c770d8c585373a99b01b7783d305a7cc,132444092,"Smartphone Motorola Moto G 5S Dual Chip Android 7.1.1 Nougat Tela 5.2"" Snapdragon 430 32GB 4G Câmera 16MP - Platinum",,Celulares e Smartphones,Smartphone,Ótimo produto,4,Yes,"Satisfaz  todas as expectativas, ótimo aparelho, recomendo com certeza.",1973.0,M,SC
2018-01-01 11:33:15,d61eb48d5f79aaf94a2b6968a85deb4eb991f0ec20329949dc79e3850b4fc273,24792691,Computador Lite Intel Dual Core G3930 2.9Ghz Memória 4gb HD 500gb Hdmi Linux Mvlig3930H1105004 Movva,,Informática,Computadores e All in One,Nao foi entregue,1,No,"Produto nem minha casa chegou, como vou diZer que recomendo ?",1994.0,M,RJ
2018-01-01 11:35:58,80c543413edefe550d876d59a82b571e06d7a4045e24062d4117d724308037c0,132620906,"Notebook Acer A515-51G-58VH Intel Core I5 8GB (GeForce 940MX com 2GB) 1TB  Tela LED 15.6"" Windows 10 - Preto",,Informática,Notebook,Top,5,Yes,"Ótimo custo-benefício, abre todos os programas pesados, rápido e não trava.",1995.0,M,MG
2018-01-01 11:36:10,9517a7a8665e2d6ea6dadaa64d0d24c22f051f68b758d7fff55ac5db65aa39a0,128031973,Faqueiro Módena 90 peças,brinox,Utilidades Domésticas,Pratos e Talheres,gostei muito do faqueiro mutito bom,4,Yes,a loja americana estar de entrega antes do prazo produto muito bom recomendo,1975.0,F,SP
2018-01-01 11:38:27,4c75f74efdc0dd9d51f2f8b1b7418994b3b8203479837a188dc141087db56700,12332933,Caixa De Som Bluetooth A Prova D´Agua - Azul,,Áudio,Dock Station e Caixas Bluetooth,Produto ruim,1,Yes,"A caixa não funciona mais, não recebe carga. Não consigo carregar.",1995.0,M,SP
2018-01-01 11:38:28,c5eb987484e85dbea71d3b6afd7b364c4a6744564ef6a88e6dbc2c9813235491,8333221,Impermeabilizante Em Spray Scotch Gard 3m - 353ml,,Casa e Construção,Materiais de Construção,Decepção,1,No,"Minha avaliação é ruim porque ainda não recebi o produto, e também nenhuma explicação sobre qual o problema está aocorrendo.",1956.0,M,RS
2018-01-01 11:38:30,54accc0c9fe8358fcdc2e625ba81d9d222c576a75ca58bc291dfe55c7230db94,132497143,Panificadora La Panina - Cadence,,Eletroportáteis,Cozinha Criativa,Gostei muito do produto,4,Yes,Faz pão maravilhosos e bolo também muito eficiente amei!!,1975.0,F,SP
2018-01-01 11:39:13,dcc00d129b660bd8a934183b5dfa12e99536aa58e4bd101fad47c19d1eb64aa5,28768527,Ventilador de Teto Ventisol Wind Branco 3 Velocidades com Controle Remoto,,Casa e Construção,Climatização,Bastante satisfeito,4,Yes,Está atendendo muto bem o produto permitindo uma ótima qualidade de vida e saúde.,1937.0,M,SP
