submission_date,reviewer_id,product_id,product_name,product_brand,site_category_lv1,site_category_lv2,review_title,overall_rating,recommend_to_a_friend,review_text,reviewer_birth_year,reviewer_gender,reviewer_state
2018-01-01 20:37:10,185f8f365d6d8b33829899af7cdbbb2fcd5217cdddcd262e259b83a7c46cb54b,125856540,"Processador All in One 1,2L + Liquidificador 1,5L + Espremedor de frutas 800W - Philco",philco,Eletroportáteis,Mixer e Processador de Alimentos,Defeito,1,No,"O liquidificador funciona, mas a outra parte veio quebrada, justamente na parte q trava o aparelho. Irei devolvê-lo.",1955.0,M,MG
2018-01-01 20:39:09,421f0953f7674b6063a9cc03aa38212bb82c803720ae1503c8069130cfbb4667,22562178,Copo Acrílico Com Canudo 500ml Rocie,,Utilidades Domésticas,"Copos, Taças e Canecas",Por esse preço,2,Yes,"Achei o produto regular, mas com um preço tão baixo assim, não tem como ser uma produto ótimo.",,,
2018-01-01 20:44:05,b55714cc95056f8f09527ca62757e80eced6683281c725db075e9c068df74e79,26975638,Painel Suspenso Lumia Rústico - Mirarack,,Móveis,"Rack, Estante e Painel",Bom custo benefício!,3,Yes,"Este painel tem um bom custo benefício, porém mesmo com dimensões modestas, tem um peso acima do esperado, o que dificulta sua montagem e instalação.",1965.0,M,RJ
2018-01-01 20:49:23,7727a667fcb11b73ee8fb8ad55bb1b05f9b96d41c974aec0c70aef3c6a903beb,11561687,Cortador Para Queijo Regulável Em Aço Inox Branco Zyliss,,Utilidades Domésticas,Utensílios e Acessórios Domésticos,Produto muito bom.,5,Yes,Produto muito bom entrega rápida e boa qualidade. Corta muito fácil recomendo.,1960.0,M,SP
2018-01-01 20:49:35,875ea467c95ddcb3a8504c1e9c233df9a5eac5123fabde4a1c81832834430d81,22562178,Copo Acrílico Com Canudo 500ml Rocie,,Utilidades Domésticas,"Copos, Taças e Canecas",Ótimo produto,5,Yes,Comprei algumas dezenas para dar de lembrança na festa de aniversário e todos convidados amaram. Aproveitem o preço acessível,,,
2018-01-01 20:53:15,899eca9573c76bcfc21a495ef7040cecd1aad2c47aff5cb3dac9120a073d5bb2,132132700,"Tablet Samsung Galaxy Tab S3  32GB 4G Tela 9.7"" Quad-Core 2.15 GHz - Prata",,Informática,Tablet e iPad,Ótimo produto,4,Yes,Produtos da Samsung são os melhores.  Só tive problema com a entrega que demorou muito. O prazo estipulado não era comum.,1994.0,F,SP
2018-01-01 20:59:20,33afcbb0c43efc3057117ad5dc691b5d79321ef8cb8e4b9bd63ff149f8bd30df,112067331,Acessório Adaptador para Smart TVs Philips Wi-Fi USB 2x2 - PTA127/55,philips,TV e Home Theater,Acessórios para TV e Vídeo,Produto não recebido.,1,No,Pedido não entregue e sem nenhuma explicação. Logo essa compra foi feito de modo positivo e só recebi pontos negativos desta loja.,1985.0,M,RJ
2018-01-01 21:00:12,f9a7e8a60708a25ffb2e1f9f11d90865556b4c09ff1509a078f1e7c75ef81e4d,22562178,Copo Acrílico Com Canudo 500ml Rocie,,Utilidades Domésticas,"Copos, Taças e Canecas",O melhor canudo para você colocar na boca.,5,Yes,Copo fantástico! Quando você está com sede ele automaticamente vai até a sua boca.  Ideal para quem sua muito transando.  O canudo inteligente se posiciona automaticamente na sua boca e evita derramamento do líquido enquanto vc faz um movimentos para cima e para baixo.,1959.0,M,SP
2018-01-01 21:00:53,53a911a1ef7e1b440c5439168f8de787566f98711651cc32c57e5fb4796ca821,24246680,Notebook Razer Blade Pro Intel I7-7820hk Uhd 4k Touch 17 Gtx 1080 Ssd 2tb Pci Express Ram 32gb,,Informática,Notebook,PREÇO RAZOAVEL,5,Yes,"dei de presente de natal para meus sobrinhos, eles adoraram como são 8 tive q dar um pra cada",,,
2018-01-01 21:01:28,adca177a9d057dc7376a288b292a214e956b7d691b1fdf49edd55ff9c45f0fab,22562178,Copo Acrílico Com Canudo 500ml Rocie,,Utilidades Domésticas,"Copos, Taças e Canecas",EXCELENTE,5,Yes,"Este copo é realmente super divertido.. Aproveitem esta SUPER PROMOÇÃO!! Comprei um jogo com 6 unidades e estou super feliz!! Só achei um pouco caro o frete, R$ 17,00!!",1976.0,M,DF
2018-01-01 21:02:32,7f81425383c768b0cbf0ed2c1be310188f0db18b46888aa856d706e37977c10a,22562178,Copo Acrílico Com Canudo 500ml Rocie,,Utilidades Domésticas,"Copos, Taças e Canecas",Líquido grátis,5,Yes,O copo vem com sistema de abastecimento contínuo de Veuve Clicquot! Super recomendo!,1982.0,F,SC
2018-01-01 21:04:16,5e6bfee58878a612ada2de2c21c9c0a33f82f96242b2130d12cf6449907aca81,22562178,Copo Acrílico Com Canudo 500ml Rocie,,Utilidades Domésticas,"Copos, Taças e Canecas",Frete,5,Yes,,1979.0,F,RJ
2018-01-01 21:06:57,24664d783e0d68795e94053af3310f2492557a5cabecf66c32cc6226db9a60b1,22678161,"Hoverboard 6,5"" Polegadas - Smart Balance- Fire Games-Bluetooth - Bateria Samsung - C/ Bolsa - Azul",,Esporte e Lazer,Skate,horrível,1,No,"pedi o hoverboard dia 05/11/2017 e até hoje não chegou,liguei várias vezes,fui várias vezes nas loas americanas falar sobre este produto e nada, é só golpe,não comprem pois é possível não chegar no prazo como o meu,e pagar um alto preço no frete e não chegar,minha filha ficou sem presente de natal e muito decepcionada,espero que chegue pelo menos NESTE ANO já que em 2017 não chegou espero tê-lo em 2019 haha.",1966.0,M,SP
2018-01-01 21:08:39,d0cd7f209ededf46536c14c7afff898b1916f1515c2c4fecc81cadcb2cd1e164,9389035,Guarda Roupa Genesis Com Porta Espelho Branco  - Gelius Móveis,,Móveis,Guarda-Roupa,Muito bom.,5,Yes,"Excelente guarda-roupa! Estou com ele a praticamente 10 anos, suportou duas enchentes e agora que o bichinho começou a ceder.",1982.0,M,BA
2018-01-01 21:12:38,e9b0574daa17fee5d5f406b67c12abf1dfdd9424468d5f8b166ff9f4f49e6d9d,132300849,Cafeteira Elétrica Britânia Duo Coffee 2 Xícaras Vermelha - 450W,,Eletroportáteis,Cafeteira,Muito bom,5,Yes,"Ótima escolha encaixou bem na minha cozinha, adoro fazer compras pela americanas sempre pontual com seus clientes.",1976.0,M,RJ
2018-01-01 21:15:18,ef2f031a153d49ac97eab80a95eaead87e38cc36eaaf7d50a10c43bfd9a5d103,128010777,"Smartphone Samsung Galaxy J7 Metal Dual Chip Android 6.0 Tela 5.5"" 16GB 4G Câmera 13MP - Dourado",samsung,Celulares e Smartphones,Smartphone,"Super aquisição, além de Lindo é eficiente!",4,Yes,"Super aquisição, além de Lindo é eficiente!!! Recomendo",,,
2018-01-01 21:16:26,9711ebf4e72d50900883ee6b2d0f781ef448f1a7c106942dbceb53e422afb20b,22562178,Copo Acrílico Com Canudo 500ml Rocie,,Utilidades Domésticas,"Copos, Taças e Canecas",Ótimo custo x beneficio,5,Yes,"Vendi minha moto para poder comprar o copo, comprei dois copos, foi o melhor investimento logo no começo de 2018, recomendo para quem está cagando dinheiro.",1997.0,M,SP
2018-01-01 21:16:41,100527ef9b7e30620e83f2e815dc1cc64826a934c7f478559f720f24ab5e4e85,132569282,"Smartphone Motorola Moto X4 Dual Cam Android 7.0 Tela 5.2"" Octa-Core 32GB Wi-Fi 4G Câmera 12MP - Azul Topázio",,Celulares e Smartphones,Smartphone,Otimo custo beneficio,4,Yes,"Aparelho bom, e aprova d' água mas não funciona muito bem embaixo d' água o touch trava e volta ao normal ao sair da água. na foto parece prata mas ele  e realmente azul topázio muito bonito mas diferente da foto , câmera excelente, gostei do produto apesar de não achar ele melhor que o modelo moto x anterior.",1991.0,F,RJ
2018-01-01 21:23:14,6da4a00173cb9302252207a14d87c027f89a76fe17f3b52b2dcbe5bf4d04b4f7,26020129,Mochila Mickey - Preta,,Malas e Acessórios,Mochilas,Muito boa. Qualidade impecavel,5,Yes,Chegou antes do previsto e minha namorada adorou. só anda com ela agora.,1986.0,M,PA
2018-01-01 21:25:18,6da4a00173cb9302252207a14d87c027f89a76fe17f3b52b2dcbe5bf4d04b4f7,128990921,Blu-Ray Harry Potter e as Relíquias da Morte - Parte 1,,Filmes e Séries,Filmes Infantis,Otima capa,5,Yes,tem bastante extras e pra quem é fã precisa ter. Minha namorada adorou.,1986.0,M,PA
2018-01-01 21:26:20,6da4a00173cb9302252207a14d87c027f89a76fe17f3b52b2dcbe5bf4d04b4f7,128990904,Blu-Ray Harry Potter e a Ordem da Fenix,,Filmes e Séries,Filmes Infantis,capa excelente,5,Yes,extras muito legais. Pra quem éfa precisa ter esse blu-ray. Minha namorada adorou.,1986.0,M,PA
2018-01-01 21:41:27,3c7b45f77f328225d0d2d8e3e327f88ab0821b18a70db6d49b27f8094ef1b819,22562178,Copo Acrílico Com Canudo 500ml Rocie,,Utilidades Domésticas,"Copos, Taças e Canecas",Custo Benefício.,5,Yes,"Gostei muito, produto me surpreendeu pela qualidade com um preço acessível a todos... Recomendo!",,,
2018-01-01 21:41:46,beeca2f0c1038c3e37b82670672cac092c89a450d8ab737983a210cbb70d2d51,22562178,Copo Acrílico Com Canudo 500ml Rocie,,Utilidades Domésticas,"Copos, Taças e Canecas",como vocês está se sentido?  assaltada!,1,No,"Copo acrílico por ""apenas"" R$ 1.994,20! Ainda vão por a culpa no estagiário pelo preço errado  kkkkkk",1969.0,F,RS
2018-01-01 21:54:16,2336816e5774475fb4f4efd55a54316960a118beef95e95c6673b10dbbc924fe,132381829,"Smart TV LED 49"" Samsung 49MU6100 UHD 4K HDR Premium com Conversor Digital 3 HDMI 2 USB 120Hz",,TV e Home Theater,TV,Excelente produto.gostei muito perfeito,5,Yes,Produto de excelente qualidade entrega rápida parabéns lojas americanas.faleu a compra.,1969.0,M,SP
2018-01-01 22:00:48,d39c8b901b612a902f5ac1bcb370cdd310545a8d49fc1978039d0e80a8e1b23e,26994359,Bingo M2 Smartband Pulseira Inteligente,,Celulares e Smartphones,Acessórios para Celular,Bateria do Bingo M2,1,No,,1996.0,M,CE
2018-01-01 22:05:26,109319396a0e7bd031a972201f309a7a23cdcb5a8833a8ef64e1adf362b73b74,14172952,Afiador Amolador Eletrico De Faca Tesoura Ferramentas E Tesoura Como Na Tv,,Linha Industrial,Equipamentos Industriais,"Péssimo,propaganda enganosa.",1,No,,1945.0,M,SP
2018-01-01 22:12:15,dd5b93d2ce72e4fb106bee4dde7cd5a51ea4a524f3b84eff5e4358e69bc4d922,23095324,Cortador De Cabelo Profissional Cobreo 2000 Cab800-127 - Cadence,,Beleza e Perfumaria,Barbearia,Máquina de corte cabelo,3,Yes,Produto muito bom de qualidade excelente para quem quer uma máquina de qualidade,1968.0,M,SP
2018-01-01 22:35:28,1191dbeb142ecb4c8bfd9d6c5591013c2120684a83d051b8e236c1f2cdc9ae29,125215742,Liquidificador Philco PH900 2L 12 Velocidades Vermelho - 900W,philco,Eletroportáteis,Liquidificador e Acessórios,BOMMM,4,Yes,OTIMO PRODUTO RECOMENDO OTIMO PRODUTO RECOMENDO OTIMO PRODUTO RECOMENDO,1959.0,M,SP
2018-01-01 22:44:40,c90b4c9bfe53e83c46a30df2591d6d9ee07630718a74414b339b303db9a98706,132381781,"Smart TV LED 40"" Samsung 40MU6100 UHD 4K HDR Premium com Conversor Digital 3 HDMI 2 USB 120Hz",,TV e Home Theater,TV,tv samsung,5,Yes,Espetacular essa tv a imagem é incrivel e o som perfeito criticas para a internet que mostra as imagens em fluorescente ou sombras em negativo é feio demais e tambem o controle remoto é bem funcional porem apresenta mesmo uma dificuldade imensa para abrir a tampa precisei de usar uma faca para remover correndo o risco de danificar o mesmo parece que vem colado de fábrica e vem com um detalhe estranho na fixação das pilhas os polos são diferentes um do outro parece que estão com defeitos mas funciona se alguem puder postar como resolver os problemas com as imagens fluorescente ou sombras negativas da internet agradeço tambem agendei o técnico por controle remoto da samsung o mesmo porem nem se manifestou na data marcada no demais como disse a tv é ótima e recomendo a compra quanto a entrega das americanas no meu caso demorou demais e não tem como rastrear pelo site ou aplicativo não funcionam.,1959.0,M,SP
2018-01-01 22:46:16,4172ded3e232a3f241587f7b93074d0eb105c4a4da7efa3cb6b3071108421bbd,20569905,Mesa Notebook Com Cooler Dobrável E Ajustável Com Formato Ergonômico Suporte Para Copo Ld-09,,Informática e Acessórios,Acessórios para Notebook,Frágil e com péssimo acabamento,2,No,"Produto fraco fácil de quebrar, acabamento com muitas rebarbas e encaixes desregulados, dá pra usar mais ficou devendo muito.",1983.0,M,MG
2018-01-01 23:02:49,eba2ad028181c49d58fe2879109e2d9e48dace5d5223d26058887ceabeaa144e,22562178,Copo Acrílico Com Canudo 500ml Rocie,,Utilidades Domésticas,"Copos, Taças e Canecas",Ótimo comprei para um orfanato inteiro,5,Yes,"Quando eu era pequeno fugia de casa para frequentar um orfanato hoje em dia sou o homem mais rico do planeta e comprei 900 desses para esse orfanato, obrigado americanas recomendo para todos esse copo",1998.0,M,BA
2018-01-01 23:04:54,cbec9f418fe7d106d199cc5b6487ffab52cb33b000ddd5697a9c334e360691fa,22562178,Copo Acrílico Com Canudo 500ml Rocie,,Utilidades Domésticas,"Copos, Taças e Canecas",?????,5,No,Como assim? kkkkkkk Sério que esse copo está esse preço? Ele faz alguma bebida sozinha?,1989.0,M,RS
2018-01-01 23:06:33,38a6b0d632fc46d8cb9ab8d62d297a1ff04fe7bcb3dc099840dc058b77689358,22562178,Copo Acrílico Com Canudo 500ml Rocie,,Utilidades Domésticas,"Copos, Taças e Canecas",Excelente,5,Yes,"Gostei muito desse copo, o investimento é altô mas vale a pena, depois que eu adquirir esse copo minha vida mudou totalmente",1988.0,F,RO
2018-01-01 23:07:10,76ef3720044571cd17b6beb50afe68cab88c43bfed260daa7e29ad6e0fc79aaa,131349704,"Smartphone Moto G 5 Dual Chip Android 7.0 Tela 5"" 32GB 4G Câmera 13MP - Platinum",motorola,Celulares e Smartphones,Smartphone,Muito bom,5,Yes,Considero o aparelho com o melhor custo/benefício.,1993.0,M,BA
2018-01-01 23:31:05,72522fa6463f244dba36c76bd3929237a29f0525fb2c711106812269635d2540,25793525,Escova Secadora Alisadora Almofadada Hair Dryer Com Cabo Giratório 360º,,Beleza e Perfumaria,Aparelhos elétricos para cabelo,O produto veio sem funcionar,1,No,"Tanta expectativa para nada, o meu chegou sem funcionar, e pior até agora não recebi nem um retorno sobre o cancelamento e terei que pagar meu cartão de crédito cobrando a escova. Muito decepcionada.",1979.0,F,PR
2018-01-01 23:49:35,dd3b8fc63c22f13739b0f22679a16b53d50a2f5af76e68fb8e064d48811c7e4f,11682383,Bicicleta Comfort Classic Plus Aro 26 Marrom - Track  Bikes,,Esporte e Lazer,Bicicleta,muita demora na entregua,2,Yes,"Recebi o produto, mas com defeito na cesta. Houve demora na entrega",1975.0,F,SP
2018-01-01 23:57:22,25024467da56467ceef7d0ea6c499832c71dea9c2d767f8b4c84616b91770688,120319219,"Árvore de Natal Tradicional Branca 2,1m - Christmas Traditions",christmas traditions,Enfeites de Natal,Árvores de Natal,Muito bonita,4,Yes,"A árvore é muito bonita e grande. A família adorou. Não é tão cheia assim, mas pelo preço valeu muito a pena. Estou muito satisfeito.",1994.0,M,RJ
2018-01-02 00:04:30,0d4b1328b9e9785c053814053cf7ce75663c6d05394e1720be72e5c5f0427cbc,22562178,Copo Acrílico Com Canudo 500ml Rocie,,Utilidades Domésticas,"Copos, Taças e Canecas",Maravilhoso,5,Yes,"Simplesmente incrível. E o melhor? Você SÓ precisa trabalhar 1 único mês pra adquiri-lo. Por um copo plástico, está muito barato.",1997.0,M,RS
2018-01-02 00:10:53,55cc37f32e2da153a193c94703034875d24184b5fc41ac49fe1d4cb4c4f4828c,22562178,Copo Acrílico Com Canudo 500ml Rocie,,Utilidades Domésticas,"Copos, Taças e Canecas",POR QUE CAR4LHOS A M3RD4 DE UM F0D3NDO COPO CUSTA QUASE 2 MIL REAIS,1,No,???????????????????????????????????????????????????????????????????????????????????????????????????????????????????????????????????????????????????????????????????????????????????????????????????????????????????????????????????????????????????????????????????????????????????????????????????????????????????????????????????????????????????????????????????????????????????????????????????????????????????????????????????????????????????????????????????????????????????????????????????????????????????????????????????????????????????????????????????????????????????????????????????????????????????????????????????????????????????????????????????????????????????????????????????????????????????????????????????????????????????????????????????????????????????????????????????????????????????????????????????????????????????????????????????????????????????????????????????????????? Eu estou indignado ???????????????????????????????????????????????????????????????????????????????????????????????????????????????????????????????????????????? desculpe pelos palavrões,,,
2018-01-02 00:11:19,fcbeba8275c4fcf695a61285fb54ddcd4a2eb89f61ccfe80f05acc3d4845ae72,20776815,Guarda-Roupa Ohio 2 Portas Branco,,Móveis,Guarda-Roupa,Não da pra montar!,1,No,"Compra efetuada em setembro/17 e hj dia 02/01/18 ainda nao consegui montar e usar porque houve erro na entrega. Produto veio em 3 volumes, sendo 2 iguais, portanto, nao da pra montar. Solicitei devolução e disseram nao ser possível e entregariam as peças faltantes. Semana passada finalmente o volume chegou e qual minha surpresa ao constatar que veio novamente o mesmo volume, sendo o terceiro volume igual! Recusei a entrega e estou solicitando novamente devolução porque essa situação é extremamente  desagradavel e desgastante.",1976.0,F,PR
2018-01-02 00:43:38,246d25d859fb03bf646ee5c0de6980cc426d8ff9001810d0ab75e6aec4d4ddd5,22562178,Copo Acrílico Com Canudo 500ml Rocie,,Utilidades Domésticas,"Copos, Taças e Canecas",Excelente,5,Yes,Nao sabia o que era felicidade ate comprar esse copo.,1987.0,M,MG
2018-01-02 00:57:23,5d9693f99195b2b3c1e6e9dfea32d3c5c673b76b203395a8bc41177972fc4b57,22562178,Copo Acrílico Com Canudo 500ml Rocie,,Utilidades Domésticas,"Copos, Taças e Canecas",Salvou minha vida,5,Yes,"Vale o investimento. Após um acidente aéreo em que o monomotor caiu no mar e as ondas me levaram até a ilha de Lost, estava em desespero. Com muita sede, rodeado por água mas sem poder bebê-la. Então me lembrei que tinha comprado este copo com sistema de dessanilização, alquimia pra conversar de líquidos em alimentos, canudo que se transforma em remo e raio laser que me ajudou na proteção contra os dinossauros. Não fosse por ele, não estaria aqui pra contar esse relato.",1992.0,M,SP
2018-01-02 01:13:38,779dbb7144c11f99c2ee510fe4815355210a9b86039aed941595c56119945037,10860686,Carregador Cabo Usb Original Samsung Ultra Rápido S6 S6 Edge,,Celulares e Smartphones,Acessórios para Celular,Quebrou em 2 dias,1,No,"Não funcionou direito, em 2 dias o encaixe quebrou. Fiz a reclamação e não recebi resposta",1982.0,F,MG
2018-01-02 01:32:38,e9a4fec47a49224c8b8feae6d0a7aea6e60cf1dc180db3fdb9c2613f56ff372a,22562178,Copo Acrílico Com Canudo 500ml Rocie,,Utilidades Domésticas,"Copos, Taças e Canecas",Super barato,4,Yes,"Simplesmente uma pechincha! Apenas 1.994,20. Dei de presente pra minha família inteira!!!!",1976.0,F,RJ
2018-01-02 01:42:24,000525332e4c48a998614c1130fee5076db74a9e629585d159e1ee056a28fc06,22562178,Copo Acrílico Com Canudo 500ml Rocie,,Utilidades Domésticas,"Copos, Taças e Canecas",Uma pechincha!!!,5,Yes,,1987.0,M,SP
2018-01-02 02:05:14,97188f73254bae75f9ad3166c6298d99ceeba1b7222724c55baf3a1227946ad7,17316111,Cabo Hdmi Divisor Splitter Duplicador Y 1 Macho Para 2 Fêmea,,Informática e Acessórios,Cabos e Adaptadores,Produto não funciona,1,No,"O produto não funciona e a loja não atende em nenhum dos contatos informados. Ela deveria ser banida do site da Americanas, pois isso prejudica imagem do site também.",1994.0,M,SP
2018-01-02 02:33:50,af8e3a52b26c9cd28700cdcf4e152a2f281b592ec4fd0e405b628e5d3bca47df,13559322,Porta Papel Higiênico Luxo 331-7,,Utilidades Domésticas,Utensílios e Acessórios Domésticos,Gostei do Produto,3,Yes,"O produto recebido atendeu minhas expectativas, ideal para quem não deseja furar a parede de sua casa. Eu recomendo!",1994.0,F,SP
2018-01-02 02:45:44,0153609464ef21e03c6e289001ea691688804bbaa03cf813f0e981c550943d09,23091215,Conjunto Sala De Jantar Mesa Andréia 4 Cadeiras Milena Cimol Savana/suede Bege,,Móveis,Mesa,A melhor compra,5,Yes,"Tive receio de comprar, na loja física era o dobro do valor, o produto tinha previsão de entrega só em fevereiro chegou antes do Natal e ficou muito lindo e perfeito na minha sala e todos elogiaram, comprem sem medo. Não faltou nenhum item e foi a melhor compra!!!!!!",1992.0,M,SP
2018-01-02 02:48:08,8b2b7f5ec7d279a85123edf93f1451a001a5ce38e63fe1cee5f4a5de1ad3cac9,22303237,Bicicleta Rino 29 Freio Hidraulico - Shimano Acera 27v,,Esporte e Lazer,Bicicleta,considerações,3,No,"bom dia,  devido ao valor, foi até satisfatório o produto,  porém poderiam listar como opcional alguns itens ao cliente pagando a diferença.  o cassete e corrente  poderiam ser shimano,  está dando problemas nas trocas de marchas. Gostaria de comprar outra mais pra frente do mesmo quadro mas com o kit alivio e o amortecedor rockshot de entrada da marca, teria como fazer um orçamento?",1988.0,M,ES
2018-01-02 02:55:07,e0b0dea674d6bebffceee549d9afce1b7f491547f6abe72325f02c939248b238,7322294,Perfume CK Be Eau de Toilette 100ml - Calvin Klein,calvin klein,Beleza e Perfumaria,Perfumaria,Não recebi o produto,1,No,Ainda não recebi o produto e estão querendo que eu faça avaliação!!,1991.0,M,RS
2018-01-02 02:57:17,937653c071e3abf6d4c7d7ed31b8d24b57ed2f0a12793eaa1a007ce49d610cf8,27712658,Conjunto de Panelas Antiaderente Paris 10 Peças Cereja - Tramontina,,Utilidades Domésticas,Panelas,Faltam especificações Técnicas no auncio..,3,Yes,,1982.0,M,SP
2018-01-02 03:00:25,83b29f15a59286f2e124600f044890a4f02deb885c5fbea8169746ad3389c173,16912037,Coifa Parede 60ct 60cm Inox Electrolux,,Eletrodomésticos,Coifa e Depurador,ótimo produto,5,Yes,"ótimo produto, lindo design. Adoramos. agora vamos ver a durabilidade.",1982.0,M,MG
2018-01-02 03:02:05,f2c247c75d074a319232d913f9cfa8c47f3b13e062abeea8d4cbd9c8e987955c,28206931,Coifa Tramontina De Parede New Vetro 90cm 220V,,Eletrodomésticos,Coifa e Depurador,Avaliação pendente,3,No,Bom dia. Como não instalei o produto e só fiz teste de bancada posso afirmar que pelo que vi o aparelho é bom. Quando a recomendar ainda não posso.,1949.0,M,SP
2018-01-02 03:06:04,9bad74e4027ae54189f79358b66e73ba06dc0560ac64a35586e4606c54b8b233,24487322,Condroplex 1000 Suplemento Avert - 60 Comprimidos,,Pet Shop,Cães,condroplex,5,Yes,Já uso este produto para o cão há algum tempo por prescrição veterinária,1962.0,F,SP
2018-01-02 03:13:04,11ea799369c3b9e248e6f9f9e4ceaef402b790bfc47a2398e096405367d3c8a6,113147421,"Painel para TV Até 52"" Modern com Suporte - Branco/Preto - Multivisão",multivisao,Móveis,"Rack, Estante e Painel",Ótimo,4,Yes,"Material bom, fácil de montar. Só o acabamento que não é dos mais perfeitos pois alguns parafusos ficam aparecendo no móvel.",1994.0,F,RJ
2018-01-02 03:14:04,e5282ec9ca9a73f0dc11c17a5d1b20bd6c1998ed0a57e20ab87ee60da9c02a2e,127371731,Mesa Com Cadeiras Patrulha Canina,multibrink,Brinquedos,Móveis para Crianças,Mutio Bom!,5,Yes,Custo x Benefício muito bom! Entrega rápida e com qualidade.,1986.0,M,SP
2018-01-02 03:14:15,5e935b101f75260fa0eae85824e7296b3829c68e940c9dcb3ac3d7556fcdbe42,22562178,Copo Acrílico Com Canudo 500ml Rocie,,Utilidades Domésticas,"Copos, Taças e Canecas",Excelente,5,Yes,"Produto excelente e com precinho oh!. Não sei como consegui viver até hoje sem um copo de acrílico de quase 2 mangos. Agora com este copo minha vida mudou!  Levo o copo pra passear, dou banho, boto pra dormir. Cuido dele com o todo o amor e carinho!",1985.0,F,SP
2018-01-02 03:14:52,8a946a64f475a3f38be114251cf02c2630f4853847b7e0e170f069445a04356f,22870558,Mouse Pad Counter Strike Global Offensive,,Informática e Acessórios,Mouse,Gostei muito do produto!,4,Yes,"Vale a pena comprar, funciona parcialmente. Vale a pena comprar, funciona parcialmente.",1995.0,M,SC
2018-01-02 03:18:50,5a1a25a323b26876be29c0275f91b2024e986076e6650e1cfbd18779d532dc49,23495731,Relógio Invicta S1 Rally Yakuza 19546,,Relógios,Relógios,PORCARIA! ME VENDERAM UM PRODUTO FALSIFICADO,1,No,"Avaliação péssima, já pedido o reembolso. Me venderam uma falsificação de 5ª categoria, empresa muito da sem vergonha em tentar um golpe como esse. Espero que me devolvam o dinheiro o quanto antes.",1986.0,M,SP
2018-01-02 03:20:35,7666c0fa9f0e745ba3d3c63d30629e24eb29b227f5ecc06e958f365a7921df9a,129002023,Conjunto de Bolas de Natal Lisas e Decoradas Douradas 6cm 30 Peças - Orb Christmas,orb christmas,Enfeites de Natal,Bolas de Natal,Amei,5,Yes,"As bolas são lindas, e o tamanho é ótimo para árvores de 1,5m! Recomendo!",1991.0,F,MG
2018-01-02 03:21:49,f7bae11c98dad1839d624f502afec3ea7e850f1b54bf2c74ef321ce16f78b4e3,22562178,Copo Acrílico Com Canudo 500ml Rocie,,Utilidades Domésticas,"Copos, Taças e Canecas",Mudou minha vida.,5,No,"Gente, esse copo tá muito barato. Qualquer um pode comprar. Depois que eu comprei ele minha vida nunca mais foi a mesma.",1977.0,M,MA
2018-01-02 03:22:05,5b5f46fe0647928be070fb1a3eae123924b3dd315ad07e7fde9f5c9e1612f5ae,22562178,Copo Acrílico Com Canudo 500ml Rocie,,Utilidades Domésticas,"Copos, Taças e Canecas",Copo,5,Yes,"Gente,que oferta imperdivel! Vou logo adquirir dois.",,,
2018-01-02 03:22:22,e6fa11edd0b1683fe548dd126ab3dc8d3bdfa951d1408580502cdb980d14f213,132118414,"Smartphone LG G6 Android 7.0 Tela 5.7"" Quad-core 2.35 GHz 32GB 4G Câmera 13MP - Platinum",lg,Celulares e Smartphones,Smartphone,Adorei o produto,4,Yes,"O celular é muito bom, tem muita memoria e o designer e maravilhoso. Adorei!!!!!!",1969.0,F,MG
2018-01-02 03:24:42,a704959119fc4c290075558f25503b05848f4e2212e9ed7c91b87317ddffc70d,25244190,Rack Mini Orion Hd 3000 Organizador De Cabos Onix 8 Canais - Hdcvi / Tvi / Ahd,,Casa e Construção,Segurança,Grande facilitador na organização,5,Yes,"Com o produto eu consegui organizar no mesmo rack o DVR, filtro de linha e fonte. Excelente para a organização. Também gostei do diferencial de fechamento com fechadura, evitando fraude.",1985.0,M,RJ
2018-01-02 03:26:04,a704959119fc4c290075558f25503b05848f4e2212e9ed7c91b87317ddffc70d,24182571,Cftv Fonte Ajustavel Mcm 12v/14v 10a Bivolt Fon1026-rs,,Casa e Construção,,Excelente para DVR de até 8 canais,5,Yes,Excelente produto para utilização em sistema de DVR de até 8 canais.,1985.0,M,RJ
